{
  "schemaVersion": "0.2-rc1",
  "runId": "run_remind_empty_0001",
  "flowId": "flow_homework_remind_01",
  "eventId": "event_timer_0001",
  "status": "succeeded_no_action",
  "startedAt": "2026-07-25T18:00:00+08:00",
  "finishedAt": "2026-07-25T18:00:00+08:00",
  "viewedAt": "2026-07-25T18:01:00+08:00",
  "error": null,
  "flowSnapshot": {
    "schemaVersion": "0.2-rc1",
    "flowId": "flow_homework_remind_01",
    "name": "周五18点提醒未交作业的同学",
    "templateId": "homework_remind_v1",
    "status": "enabled",
    "hook": { "type": "scheduled", "params": { "runAt": "2026-07-25T18:00:00+08:00", "timezone": "Asia/Shanghai" } },
    "actions": [
      { "actionId": "action_read_unsubmitted", "type": "read_unsubmitted", "params": { "taskAttachmentId": "task_se_week03" } },
      { "actionId": "action_build_recipients", "type": "build_recipient_list", "params": {} },
      { "actionId": "action_send_reminder", "type": "send_direct_message_batch", "params": { "text": "本周作业即将截止，请尽快提交。" } }
    ],
    "taskAttachmentId": "task_se_week03",
    "createdAt": "2026-07-21T09:25:00+08:00",
    "updatedAt": "2026-07-21T09:30:00+08:00",
    "deletedAt": null
  },
  "eventSnapshot": {
    "schemaVersion": "0.2-rc1",
    "eventId": "event_timer_0001",
    "type": "timer_fired",
    "occurredAt": "2026-07-25T18:00:00+08:00",
    "payload": { "scheduledFor": "2026-07-25T18:00:00+08:00", "timezone": "Asia/Shanghai" }
  },
  "steps": [
    { "actionId": "action_read_unsubmitted", "actionType": "read_unsubmitted", "status": "succeeded", "startedAt": "2026-07-25T18:00:00+08:00", "finishedAt": "2026-07-25T18:00:00+08:00", "input": { "taskAttachmentId": "task_se_week03" }, "output": { "members": [] }, "error": null },
    { "actionId": "action_build_recipients", "actionType": "build_recipient_list", "status": "succeeded", "startedAt": "2026-07-25T18:00:00+08:00", "finishedAt": "2026-07-25T18:00:00+08:00", "input": { "members": [] }, "output": { "userIds": [] }, "error": null },
    { "actionId": "action_send_reminder", "actionType": "send_direct_message_batch", "status": "skipped", "startedAt": null, "finishedAt": null, "input": { "userIds": [] }, "output": null, "error": null }
  ]
}
